{
  "$schema": "../schema/lesson.schema.json",
  "id": "thales-participial-phrase-front",
  "version": "0.1",
  "updated": "2026-08-19",
  "authors": {
    "content": "김수정",
    "prompt": "Claude 초안"
  },
  "category": "리딩",
  "topic_intro": "고대 그리스의 철학자 탈레스",
  "sentence": "Born in the city of Miletus in Asia Minor, he lived from around 624 B.C. to 546 B.C.",
  "grammar_type": "분사구문(과거분사)_문장앞",
  "split_rule": {
    "when": "분사구문이 앞에 있는 경우",
    "how": "쉼표(,) 앞까지 끊는다",
    "labels": [
      "(1)",
      "(2)"
    ]
  },
  "proper_nouns": [
    {
      "en": "Miletus",
      "ko": "밀레투스",
      "type": "place"
    },
    {
      "en": "Asia Minor",
      "ko": "소아시아",
      "type": "region"
    },
    {
      "en": "Thales",
      "ko": "탈레스",
      "type": "person"
    }
  ],
  "proper_noun_tip": {
    "tell_once_on_first_appearance": true,
    "message": "대문자로 시작하는 고유명사는 한국어로 해석하지 않고 그대로 읽어도 돼요."
  },
  "chunks": [
    {
      "id": 1,
      "text": "Born in the city of Miletus in Asia Minor,",
      "model_translation": "소아시아의 밀레투스라는 도시에서 태어난",
      "praise": "Born을 '태어난'으로 잡아서 뒤 문장과 이어 준 거 정말 잘했어요.",
      "scoring_points": [
        {
          "id": 1,
          "text": "in을 '~에서'로 처리",
          "check": [
            "에서"
          ],
          "nudge": "in the city of Miletus가 장소를 말하고 있어요. 한국어로는 어떤 조사를 붙일까요?",
          "tell": "여기 in은 '~에서'예요."
        },
        {
          "id": 2,
          "text": "born을 '태어난'(수식)으로 처리",
          "check": [
            "태어난",
            "태어나서",
            "태어났던"
          ],
          "nudge": "born이 이 문장의 동사인지, 뒤에 오는 사람을 꾸미는 말인지부터 볼까요?",
          "tell": "여기 born은 '태어난'으로 뒤를 꾸며요."
        }
      ],
      "error_priority": [
        "E2",
        "E3",
        "E1"
      ],
      "expected_errors": [
        {
          "id": "E1",
          "detect": "born을 '태어났다'(동사)로 해석함",
          "signals": [
            "태어났다",
            "태어나다"
          ],
          "treatment": {
            "message": "좋은 시도예요! 그런데 하나만 물어볼게요~ Born이 동사일까요, 과거분사일까요?",
            "choices": [
              {
                "id": "verb",
                "label": "동사",
                "correct": false
              },
              {
                "id": "participle",
                "label": "과거분사",
                "correct": true
              }
            ],
            "on_choice": {
              "participle": {
                "message": "잘했어요! ✨ 앞으로는 '태어났다'보다 '태어난'으로 하면 더 좋아요~",
                "reveal_answer": false,
                "next": "retry_chunk"
              },
              "verb": {
                "message": "괜찮아요, 이제 알면 되죠^^ born은 bear(낳다)라는 동사의 과거분사예요. 여기서는 동사가 아니라, 분사로 쓰여서 메인 문장을 꾸며주고 있는 거예요. (참고: bear - bore - born)",
                "reveal_answer": false,
                "next": "retry_with_prompt:그럼 '태어난'으로 다시 한번 해볼까요?"
              }
            }
          }
        },
        {
          "id": "E2",
          "detect": "city of Miletus나 Asia Minor를 주어로 해석함('~가/은/는' 사용)",
          "signals": [
            "가 태어",
            "은 태어",
            "는 태어",
            "이 태어",
            "밀레투스가",
            "밀레투스는",
            "소아시아가",
            "소아시아는",
            "도시가",
            "도시는"
          ],
          "treatment": {
            "message": "방금 'city of Miletus'를 주어로 해석한 부분만 살짝 아쉬워요! in 같은 전치사는 보통 '~에서' 또는 '~안에서'로 해석이 많이 돼요. 참고로 '은,는,이,가'가 붙으면 주어예요~ 한 번 올바른 해석을 골라볼까요?",
            "choices": [
              {
                "id": "1",
                "label": "city of Miletus가 태어났다",
                "correct": false
              },
              {
                "id": "2",
                "label": "city of Miletus에서 태어난",
                "correct": true
              }
            ],
            "on_choice": {
              "1": {
                "message": "정답은 2번이에요. 전치사 in이 있으니 'city of Miletus에서 태어난'이 맞아요.",
                "reveal_answer": true,
                "next": "retry_chunk"
              },
              "2": {
                "message": "맞아요! 'city of Miletus에서 태어난'이 올바른 해석이에요.",
                "reveal_answer": false,
                "next": "retry_chunk"
              }
            }
          }
        },
        {
          "id": "E3",
          "detect": "수식 어순 혼동 — 큰 지역(Asia Minor)이 뒤로 감 (한국어 어순 간섭)",
          "signals": [
            "밀레투스의 소아시아",
            "밀레투스라는 도시의 소아시아"
          ],
          "rounds": [
            {
              "round": 1,
              "style": "short_correction",
              "forbid": [
                "explain_principle"
              ],
              "message": "아깝다~ 순서만 살짝 뒤집혔어요! Miletus의 Asia Minor가 아니라 Asia Minor의 Miletus, 즉 '소아시아의 밀레투스'예요. 영어는 한국어랑 순서가 반대거든요! 이 순서로 ①을 다시 한번 해볼까요?",
              "on_why_question": {
                "message": "질문 정말 잘했어요^^ 주소를 생각하면 쉬워요! 한국어는 '서울시 강남구'처럼 큰 곳부터, 영어는 'Gangnam-gu, Seoul'처럼 작은 곳부터 말하거든요. 그래서 해석할 땐 뒤에서부터 뒤집어주면 돼요~",
                "next": "retry_chunk"
              },
              "next": "retry_chunk"
            },
            {
              "round": 2,
              "style": "binary_choice",
              "forbid": [
                "repeat_round_1"
              ],
              "message": "앗, 아까 그 순서네요~ 괜찮아요, 이번엔 같이 골라볼까요?",
              "choices": [
                {
                  "id": "1",
                  "label": "밀레투스라는 도시의 소아시아에서 태어난",
                  "correct": false
                },
                {
                  "id": "2",
                  "label": "소아시아의 밀레투스라는 도시에서 태어난",
                  "correct": true
                }
              ],
              "on_choice": {
                "1": {
                  "message": "정답은 2번이에요. 영어는 작은 곳이 앞, 큰 곳이 뒤라서 해석할 땐 '소아시아의 밀레투스'로 뒤집어 주면 돼요.",
                  "reveal_answer": true,
                  "next": "retry_chunk"
                },
                "2": {
                  "message": "맞아요! 그 순서로 ①을 한번 통째로 다시 해석해볼까요?",
                  "reveal_answer": false,
                  "next": "retry_chunk"
                }
              }
            }
          ]
        }
      ],
      "anticipated_responses": [
        {
          "when": "asked_meaning_of_born",
          "match": [
            "태어나다"
          ],
          "do_not_repeat_question": true,
          "message": "음, 비슷했어요~ 근데 born은 여기서 동사가 아니고 분사예요! 그래서 '태어난'이라고 해석하면 더 좋아요^^",
          "next": "retry_chunk"
        }
      ],
      "anticipated_questions": [
        "Asia Minor가 뭐에요?"
      ]
    },
    {
      "id": 2,
      "text": "he lived from around 624 B.C. to 546 B.C.",
      "model_translation": "그는 기원전 약 624년부터 546년까지 살았다",
      "praise": "B.C.를 '기원전'으로 정확히 본 거 정말 잘했어요.",
      "scoring_points": [
        {
          "id": 1,
          "text": "he/lived를 주어/동사로 처리",
          "check": [
            "살았",
            "살다"
          ],
          "nudge": "문장의 주어와 동사부터 찾아볼까요? 앞쪽에 있어요.",
          "tell": "he lived는 '그는 ~ 살았다'예요."
        },
        {
          "id": 2,
          "text": "from~to를 '~부터 ~까지'로 처리",
          "check": [
            "부터"
          ],
          "nudge": "from과 to가 짝을 이루고 있어요. 숫자 두 개를 어떻게 이어 줄까요?",
          "tell": "from ~ to는 '~부터 ~까지'예요."
        },
        {
          "id": 3,
          "text": "B.C.를 '기원전'으로 처리",
          "check": [
            "기원전"
          ],
          "nudge": "B.C.를 '기원후'로 보면 시대가 반대가 돼요. 예수 탄생을 기준으로 앞쪽일까요, 뒤쪽일까요?",
          "tell": "B.C.는 '기원전'이에요."
        }
      ],
      "error_priority": [
        "E4"
      ],
      "expected_errors": [
        {
          "id": "E4",
          "detect": "B.C.를 '기원후'로 해석함",
          "never_mark_correct": true,
          "signals": [
            "기원후"
          ],
          "treatment": {
            "style": "short_correction",
            "message": "거의 다 왔는데 딱 하나만요! B.C.는 '기원후'가 아니라 기원전이에요. 기원후는 A.D.! '기원전'으로 바꿔서 다시 말해볼까요?",
            "next": "retry_chunk"
          }
        }
      ],
      "teach_points": [
        {
          "id": 1,
          "label": "주어/동사",
          "message": "he가 주어, lived가 동사예요."
        },
        {
          "id": 2,
          "label": "from ~ to",
          "message": "from ~ to는 '~부터 ~까지'로 해석해요."
        },
        {
          "id": 3,
          "label": "around",
          "message": "around는 '약/대략'이에요.",
          "enrichment": "동의어로 about, approximately도 같은 뜻으로 자주 써요."
        },
        {
          "id": 4,
          "label": "B.C.",
          "message": "B.C.는 '기원전'이에요.",
          "enrichment": "A.D.는 '서기'예요."
        }
      ]
    }
  ]
}
